{"adapter_version":"ibkr-adapter-v2.1","asset_class":"US_EQUITY","created_at":"2026-09-04T21:00:00Z","expires_at":"2027-09-04T21:00:00Z","operational_gate_status":"QUALIFIED","qualification_id":"qual.ibkr.rest-ws.001","qualification_schema_version":1,"reconciliation_pass_rate_pct":"99.99","single_writer_fenced":true,"supported_capabilities":["LIMIT_ORDER","MARKET_ORDER","CANCEL_REPLACE","ORDER_STATUS_POLL"],"venue":"venue.interactive-brokers"}
